name,url,image,desc,message,rdesc,sequence,qabalah,hebrew_letter,meditation,cardtype
Ace of Cups,ace_of_cups,images/cu01.jpeg,The beginning of a love relationship. Expression of warm feelings. Romantic longing for something extraordinary. Emotional and spiritual growth.,,"Emotional dryness, feeling oneself empty. Avoidance of intimacy, negative feelings, heartbreak.",55,&#x1f704; (Water) of Kether,,,ace
Two of Cups,two_of_cups,images/cu02.jpeg,"Partnership. A romantic relationship or a close personal alliance. Interpersonal dynamics based on social norms. Passion in a love relationship, which may turn against itself.",,"A crisis in a couple relationship, disappointment with someone close to you.",56,♀ in ♋︎ (Venus in Cancer),,,minor
Three of Cups,three_of_cups,images/cu03.jpeg,Birth. Something new brings joy and happiness. Caring for a child. Issues of child-parent relations. A common project motivated by feelings and not only by interests.,,"Problems in relations with one’s parents, or with one’s child. A strong alliance of two persons leaves a third one outside.",57,☿ in ♋︎ (Mercury in Cancer),,,minor
Four of Cups,four_of_cups,images/cu04.jpeg,"Family. A collective of people (family, community etc.) with a history and a sense of belonging. Commitment to a group, at the price of giving up personal interests.",,Problems and discord in the family or in a long-lasting community. A fixed social structure which doesn’t allow for adaptation or flexibility.,58,☾ in ♋︎ (Moon in Cancer),,,minor
Five of Cups,five_of_cups,images/cu05.jpeg,"Links. Popularity, relations with many people. Becoming the center of attention in a group. Relying on connections with other people to advance oneself or to overcome difficulties.",,Excessive preoccupation with social activity. Losing oneself in multiple superficial connections. Cultivating virtual instead of real contacts.,59,♂ in ♏︎ (Mars in Scorpio),,,minor
Six of Cups,six_of_cups,images/cu06.jpeg,Continuity. A long-term relationship. Repetition between different generations in the family. A stable personal alliance.,,"Monotony, tedious repetition. Falling time and again into the same emotional traps.",60,☉ in ♏︎ (Sun in Scorpio),,,minor
Seven of Cups,seven_of_cups,images/cu07.jpeg,Individuality. A single person finding his place in a group. Contact with people in high positions. Exceptional qualities are appreciated.,,"Problems of integration in a group or an organization. Being part of a collective, but feeling isolated and estranged.",61,♀ in ♏︎ (Venus in Scorpio),,,minor
Eight of Cups,eight_of_cups,images/cu08.jpeg,Involvement. Developing personal relationships within a group. A favorable human-relations environment. A feast or a family event.,,Interference of the environment in a couple’s relationships. Pressures from one’s family in romantic or personal matters.,62,♄ in ♓︎ (Saturn in Pisces),,,minor
Nine of Cups,nine_of_cups,images/cu09.jpeg,"Collectivity. A group or organization working harmoniously with everyone finding his proper place. Accepting one’s role in a social environment. Happiness, wishes coming true.",,"A confusing social situation, difficulty in situating oneself within a complex environment.",63,♃ in ♓︎ (Jupiter in Pisces),,,minor
Ten of Cups,ten_of_cups,images/cu10.jpeg,Leadership. A person with special qualities receives appreciation and high status. Assuming responsibility for others. Maintaining a superior position.,,"A fallen leader, loss of popularity. Disappointment because of ingratitude by people one has helped.",64,♂ in ♓︎ (Mars in Pisces),,,minor
King of Clubs,king_of_clubs,images/waki.jpeg,A mature attitude to urges and desires. Controlled creativity. Prodding oneself to make a move forward. Investing present assets in future projects.,,"Plans to move forward are frustrated by self-defeating acts. Hesitation, conflicts, tendency to make things too heavy and complex.",65,&#1497; of &#x1f702; (Yod of Fire),,,court
Queen of Clubs,queen_of_clubs,images/waqu.jpeg,"A feminine figure with a strong personality. Things connected with food and eating. Speaking softly while holding a big stick. A secure, well-defended position.",,"Intimidation, menace. Using sexuality as a means of control. Problems with a strong mother figure. Fear of feminine power.",66,&#1492; of &#x1f702; (Heh of Fire),,,court
Knight of Clubs,knight_of_clubs,images/wakn.jpeg,"A change of direction, following one’s urges and passions. A temporary stop, but there is still energy and a desire to advance.",,Preoccupation with the satisfaction of one’s own desires. Problem in defining long-term goals. Submitting to temptation.,67,&#1493; of &#x1f702; (Vav of Fire),,,court
Page of Clubs,page_of_clubs,images/wapa.jpeg,A creative potential which still needs processing. Keeping a safe distance from events and waiting for the right moment.,,A task too heavy for the querent’s strength. Difficulty in controlling desires and urges. Immature approach to sexuality.,68,&#1492; of &#x1f702; (Heh (final) of Fire),,,court
Ace of Clubs,ace_of_clubs,images/wa01.jpeg,"Creative momentum. Active sexuality. Strong impulses, energy and drive. Life force. Beginning of growth. Dispersing one’s efforts in different directions.",,"Lack of energy, restriction, repressed sexuality, a creative block.",69,&#x1f702; (Fire) of Kether,,,ace
Two of Clubs,two_of_clubs,images/wa02.jpeg,Crossroads. Several options or ways to choose from. Every course offers benefits. A brief encounter with someone going his own way. Blocking an opponent’s line of advance.,,(similar to upright) Crossroads. Several options or ways to choose from. Every course offers benefits. A brief encounter with someone going his own way. Blocking an opponent’s line of advance.,70,♂  in ♈︎ (Mars in Aries),,,minor
Three of Clubs,three_of_clubs,images/wa03.jpeg,Direction. Moving forward after a moment of hesitation. Finding a middle path between two courses of action. Gaining an advantage by keeping neutrality between two conflicting sides.,,(similar to upright) Direction. Moving forward after a moment of hesitation. Finding a middle path between two courses of action. Gaining an advantage by keeping neutrality between two conflicting sides.,71,☉ in ♈︎ (Sun in Aries),,,minor
Four of Clubs,four_of_clubs,images/wa04.jpeg,"Stalemate. A temporary stop in order to prepare for future advancement. Tensions at present, but good prospects in the long run. Making a move now is in nobody’s interest.",,"(similar to upright) Stalemate. A temporary stop in order to prepare for future advancement. Tensions at present, but good prospects in the long run. Making a move now is in nobody’s interest.",72,♀ in ♈︎ (Venus in Aries),,,minor
Five of Clubs,five_of_clubs,images/wa05.jpeg,Overcoming. Getting over a weak opposition. Breakdown of an equilibrium. Focusing on the main objective. An initiative to make a winning move.,,"(top right leaf becomes bottom left) Walking into a complex situation, losing one’s edge.",73,♄ in ♌︎ (Saturn in Leo),,,minor
Six of Clubs,six_of_clubs,images/wa06.jpeg,Collaboration. A strong alliance between two parties with different goals but common present interests. A taste for luxury made possible by favorable conditions.,,(with the decorated flower at the bottom) Excessive pursuit of luxury. Need to break up an alliance of opponents.,74,♃ in ♌︎ (Jupiter in Leo),,,minor
Seven of Clubs,seven_of_clubs,images/wa07.jpeg,"Struggle. Someone putting up a fight against many opponents. Obstinacy, endurance, keeping one’s position in a conflict situation. A difficult combat with an uncertain outcome.",,"(similar to upright) Struggle. Someone putting up a fight against many opponents. Obstinacy, endurance, keeping one’s position in a conflict situation. A difficult combat with an uncertain outcome.",75,♂ in ♌︎ (Mars in Leo),,,minor
Eight of Clubs,eight_of_clubs,images/wa08.jpeg,Regulation. It is possible to advance only by following the rules. Occupation with short-term goals while losing the long-term perspective. A roadblock.,,(similar to upright) Regulation. It is possible to advance only by following the rules. Occupation with short-term goals while losing the long-term perspective. A roadblock.,76,☿ in ♐︎ (Mercury in Sagittarius),,,minor
Nine of Clubs,nine_of_clubs,images/wa09.jpeg,Interruption. Difficulties and oppositions too hard to overcome. Giving up one’s projects to avoid conflict. Starting anew after a challenging period.,,(similar to upright) Interruption. Difficulties and oppositions too hard to overcome. Giving up one’s projects to avoid conflict. Starting anew after a challenging period.,77,☾ in ♐︎ (Moon in Sagittarius),,,minor
Ten of Clubs,ten_of_clubs,images/wa10.jpeg,Loyalty. A partnership or an alliance endures hardships and succeeds in getting over them. Pure intentions and perseverance lead to success. Honoring one’s principles in spite of difficulties.,,(similar to upright) Loyalty. A partnership or an alliance endures hardships and succeeds in getting over them. Pure intentions and perseverance lead to success. Honoring one’s principles in spite of difficulties.,78,♄ in ♐︎ (Saturn in Sagittarius),,,minor
